Word,Reading,Meaning (English),Meaning (Japanese),Meaning (Chinese),Example Question
最寄り,もより,"nearest, neighboring",すぐ近く、一番近いこと,最近、附近,最寄りの駅まで徒歩何分ですか？
値打ち,ねうち,"value, worth",価値、値段,价值,この切手にはどれくらいの値打ちがありますか？
善し悪し,よしあし,"good or bad, merits and demerits",良いことと悪いこと、是非,好坏、是非,事の善し悪しを自分で判断できますか？
目のあたり,まのあたり,"in one's presence, before one's eyes",目の前、直面,眼下、亲眼目睹,奇跡を目の当たりにしたことはありますか？
手際,てぎわ,"skill, efficiency, workmanship",物事を処理する手並み、腕前,手法、技巧,料理の手際が良いと褒められたことはありますか？
始末,しまつ,"management, settlement, (bad) outcome",処理、締めくくり、悪い結果,处理、收拾、结局,自分の不始末の始末をどうつけるつもりですか？
片言,かたこと,"broken (language), prattle",たどたどしい言葉、不完全な言葉,只言片语、生硬的话,片言の英語で道案内をした経験はありますか？
過密,かみつ,"overcrowded, tight (schedule)",混みすぎていること,过密、稠密,過密なスケジュールをどう管理していますか？
画期的,かっきてき,"ground-breaking, revolutionary",新時代を開くような、今までになかった,划时代的,それが画期的なアイデアだと思った理由はなんですか？